[{
  "name": "pnp-sp-fx-aces-officelocations",
  "source": "pnp",
  "title": "Office Locations",
  "shortDescription": "This sample shows how to build an ACE with multiple card views to show the details of the offices in an organization.",
  "url": "https://github.com/pnp/sp-dev-fx-aces/tree/main/samples/ImageCard-OfficeLocations",
  "longDescription": [
    "This sample shows how to build an ACE with a PrimaryText card view and a quick view to display current logged in user's immediate upcoming shift in card view and all upcoming shifts in Quick view."
  ],
  "creationDateTime": "2022-02-15",
  "updateDateTime": "2022-06-01",
  "products": [
    "SharePoint",
    "Viva"
  ],
  "metadata": [{
      "key": "CLIENT-SIDE-DEV",
      "value": "React"
    },
    {
      "key": "SPFX-VERSION",
      "value": "1.14.0"
    }
  ],
  "thumbnails": [{
    "type": "image",
    "order": 100,
    "url": "https://raw.githubusercontent.com/pnp/sp-dev-fx-aces/main/samples/ImageCard-OfficeLocations/assets/ace-demo.gif",
    "alt": "Preview"
  }],
  "authors": [{
    "gitHubAccount": "anoopt",
    "pictureUrl": "https://github.com/anoopt.png",
    "name": "Anoop Tatti"
  }],
  "references": [{
      "name": "Viva Connections Extensibility guidance",
      "description": "Adaptive Card Extensions are client-side components that run in the context of a SharePoint page.",
      "url": "https://aka.ms/viva/connections/extensibility"
    },
    {
      "name": "Adaptive Card Documentation",
      "description": "Detailed documentation on Adaptive Cards including the Adaptive Card designer.",
      "url": "https://adaptivecards.io/"
    }, {
      "name": "Adaptive Card Extension Design Guidance",
      "description": "Design guidance for laying out Adaptive Card Extensions.",
      "url": "https://docs.microsoft.com/en-us/sharepoint/dev/spfx/viva/design/design-intro"
    }
  ]
}]