[{
  "name": "pnp-sp-fx-aces-primarytextcard-workiq-todaysummary",
  "source": "pnp",
  "title": "Today with Work IQ (PrimaryTextCard-WorkIQ-TodaySummary)",
  "shortDescription": "Viva Connections card showing a Work IQ-generated 'what's relevant today' summary, via a C# Azure Function OBO proxy.",
  "url": "https://github.com/pnp/sp-dev-fx-aces/tree/main/samples/PrimaryTextCard-WorkIQ-TodaySummary",
  "longDescription": [
    "A Primary Text Card ACE for the Viva Connections dashboard that shows a short, Work IQ-generated 'what's relevant to you today' summary for the signed-in user, pulled from their files, meetings, and messages. The Quick View expands into the underlying referenced items. Calls the Work IQ REST Chat API through a C# Azure Function proxy that performs an On-Behalf-Of token exchange and caches responses to control Copilot Credits spend."
  ],
  "creationDateTime": "2026-07-10",
  "updateDateTime": "2026-07-10",
  "products": [
    "SharePoint",
    "Viva"
  ],
  "metadata": [{
      "key": "CLIENT-SIDE-DEV",
      "value": "TypeScript"
    },
    {
      "key": "SPFX-VERSION",
      "value": "1.23.2"
    },
    {
      "key": "CARD-TEMPLATE",
      "value": "PrimaryText"
    },
    {
      "key": "API-BACKEND",
      "value": "C# Azure Functions (isolated worker)"
    }
  ],
  "thumbnails": [{
    "type": "image",
    "order": 100,
    "url": "https://raw.githubusercontent.com/pnp/sp-dev-fx-aces/main/samples/PrimaryTextCard-WorkIQ-TodaySummary/assets/demo.gif",
    "alt": "Preview"
  }],
  "authors": [{
    "gitHubAccount": "AhmadiRamin",
    "pictureUrl": "https://github.com/AhmadiRamin.png",
    "name": "Ramin Ahmadi",
    "company": "codingwithramin.com"
  }],
  "references": [{
      "name": "Work IQ overview",
      "description": "Learn about the Work IQ API for building AI applications that securely reason over workplace intelligence data.",
      "url": "https://learn.microsoft.com/en-us/microsoft-365/copilot/extensibility/work-iq/"
    },
    {
      "name": "Work IQ REST API overview",
      "description": "Programmatically engage in multiturn conversations with Microsoft 365 Copilot using the Work IQ Chat API.",
      "url": "https://learn.microsoft.com/en-us/microsoft-365/copilot/extensibility/work-iq/rest/overview"
    },
    {
      "name": "Viva Connections Extensibility guidance",
      "description": "Adaptive Card Extensions are client-side components that run in the context of a SharePoint page.",
      "url": "https://aka.ms/viva/connections/extensibility"
    },
    {
      "name": "Adaptive Card Documentation",
      "description": "Detailed documentation on Adaptive Cards including the Adaptive Card designer.",
      "url": "https://adaptivecards.io/"
    },
    {
      "name": "Microsoft identity platform: On-Behalf-Of flow",
      "description": "How a confidential client exchanges a user's token for a token to a downstream API.",
      "url": "https://learn.microsoft.com/en-us/entra/identity-platform/v2-oauth2-on-behalf-of-flow"
    }
  ]
}]
