[
  {
    "name": "pnp-sp-fx-aces-ace-plannertasks",
    "source": "pnp",
    "title": "Planner Tasks",
    "shortDescription": "Adaptive Card displays of Planner Tasks",
    "url": "https://github.com/pnp/sp-dev-fx-aces/tree/main/samples/PrimaryTextCard-PlannerTasks",
    "longDescription": [
      "ACE with a PrimaryText card view and multiple quick views to display the logged-in user Planner Tasks from all associated plans."
    ],
    "creationDateTime": "2021-10-06",
    "updateDateTime": "2021-10-06",
    "products": [
      "SharePoint",
      "Viva"
    ],
    "metadata": [
      {
        "key": "CLIENT-SIDE-DEV",
        "value": "React"
      },
      {
        "key": "SPFX-VERSION",
        "value": "1.13.0"
      }
    ],
    "thumbnails": [
      {
        "type": "image",
        "order": 100,
        "url": "https://raw.githubusercontent.com/pnp/sp-dev-fx-aces/main/samples/PrimaryTextCard-PlannerTasks/assets/demo.gif",
        "alt": "London Transport"
      }
    ],
    "authors": [
      {
        "gitHubAccount": "ejazhussain",
        "company": "Content+Cloud",
        "pictureUrl": "https://github.com/ejazhussain.png",
        "name": "Ejaz Hussain",
        "twitter": "EjazHussain_"
      }
    ],
    "references": [
      {
        "name": "Viva Connections Extensibility guidance",
        "description": "Adaptive Card Extensions are client-side components that run in the context of a SharePoint page.",
        "url": "https://aka.ms/viva/connections/extensibility"
      }
    ]
  }
]
