[
  {
    "name": "pnp-sp-fx-aces-scenario-ace-microsoftgraph",
    "source": "pnp",
    "title": "Microsoft Graph - ACE Scenario",
    "shortDescription": "Starting point on building Microsoft Graph connected ACE extension for Microsoft Viva",
    "url": "https://github.com/pnp/sp-dev-fx-aces/tree/main/scenarios/ace-microsoftgraph",
    "longDescription": [
      ""
    ],
    "creationDateTime": "2021-06-10",
    "updateDateTime": "2022-12-09",
    "products": [
      "SharePoint",
      "Viva"
    ],
    "metadata": [
      {
        "key": "CLIENT-SIDE-DEV",
        "value": "React"
      },
      {
        "key": "SPFX-VERSION",
        "value": "1.16.0"
      }
    ],
    "thumbnails": [
      {
        "type": "image",
        "order": 100,
        "url": "https://raw.githubusercontent.com/pnp/sp-dev-fx-aces/main/scenarios/ace-microsoftgraph/assets/preview.png",
        "alt": "Preview"
      }
    ],
    "authors": [
      {
        "gitHubAccount": "waldekmastykarz",
        "pictureUrl": "https://github.com/waldekmastykarz.png",
        "name": "Waldek Mastykarz"
      }
    ],
    "references": [
      {
        "name": "Viva Connections Extensibility guidance",
        "description": "Adaptive Card Extensions are client-side components that run in the context of a SharePoint page.",
        "url": "https://aka.ms/viva/connections/extensibility"
      }
    ]
  }
]
