[{
  "name": "pnp-sp-fx-aces-my-recent-files",
  "source": "pnp",
  "title": "My Recent Files",
  "shortDescription": "This Adaptive Card Extension allows user quick access recent files",
  "url": "https://github.com/pnp/sp-dev-fx-aces/tree/main/samples/ImageCard-my-recent-files",
  "longDescription": [
    "This Adaptive Card Extension allows user quick access recent files"
  ],
  "creationDateTime": "2022-04-12",
  "updateDateTime": "2022-04-12",
  "products": [
    "SharePoint",
    "Viva"
  ],
  "metadata": [{
      "key": "CLIENT-SIDE-DEV",
      "value": "React"
    },
    {
      "key": "SPFX-VERSION",
      "value": "1.14.0"
    }
  ],
  "thumbnails": [{
    "type": "image",
    "order": 100,
    "url": "https://raw.githubusercontent.com/pnp/sp-dev-fx-aces/main/samples/ImageCard-my-recent-files/assets/demo.png",
    "alt": "Preview"
  }],
  "authors": [{
    "gitHubAccount": "joaojmendes",
    "company": "VALO Solutions Ltd",
    "pictureUrl": "https://github.com/joaojmendes.png",
    "name": "Jo√£o Mendes",
    "twitter": "joaojmendes"
  }],
  "references": [{
      "name": "Viva Connections Extensibility guidance",
      "description": "Adaptive Card Extensions are client-side components that run in the context of a SharePoint page.",
      "url": "https://aka.ms/viva/connections/extensibility"
    },
    {
      "name": "Adaptive Card Documentation",
      "description": "Detailed documentation on Adaptive Cards including the Adaptive Card designer.",
      "url": "https://adaptivecards.io/"
    }, {
      "name": "Adaptive Card Extension Design Guidance",
      "description": "Design guidance for laying out Adaptive Card Extensions.",
      "url": "https://docs.microsoft.com/en-us/sharepoint/dev/spfx/viva/design/design-intro"
    }
  ]
}]