[
  {
    "name": "pnp-sp-fx-aces-TODO",
    "source": "pnp",
    "title": "TODO",
    "shortDescription": "TODO",
    "url": "https://github.com/pnp/sp-dev-fx-aces/tree/main/samples/TODO",
    "longDescription": [
      "TODO"
    ],
    "creationDateTime": "2021-04-02",
    "updateDateTime": "2021-04-02",
    "products": [
      "SharePoint",
      "Office"
    ],
    "metadata": [
      {
        "key": "CLIENT-SIDE-DEV",
        "value": "React"
      },
      {
        "key": "SPFX-VERSION",
        "value": "1.11.0"
      }
    ],
    "thumbnails": [
      {
        "type": "image",
        "order": 100,
        "url": "https://github.com/pnp/sp-dev-fx-aces/raw/main/samples/TODO",
        "alt": "TODO"
      }
    ],
    "authors": [
      {
        "gitHubAccount": "TODO",
        "pictureUrl": "https://github.com/TODO.png",
        "name": "TODO",
        "twitter": "TODO"
      }
    ],
    "references": [
      {
        "name": "Viva Connections Extensibility guidance",
        "description": "Adaptive Card Extensions are client-side components that run in the context of a SharePoint page.",
        "url": "https://aka.ms/viva/connections/extensibility"
      }
    ]
  }
]
