[{
  "name": "pnp-sp-fx-aces-statusmessage",
  "source": "pnp",
  "title": "Teams Status ACE Example",
  "shortDescription": "This ACE demonstrates how to use the Presence Graph API endpoints (beta) to set and retrieve a presence status message for a user.",
  "url": "https://github.com/pnp/sp-dev-fx-aces/tree/main/samples/BasicCard-StatusMessage",
  "longDescription": [
    "This ACE demonstrates how to use the Presence Graph API endpoints (beta) to set and retrieve a presence status message for a user."
  ],
  "creationDateTime": "2022-12-21",
  "updateDateTime": "2022-12-21",
  "products": [
    "SharePoint",
    "Viva"
  ],
  "metadata": [{
      "key": "CLIENT-SIDE-DEV",
      "value": "React"
    },
    {
      "key": "SPFX-VERSION",
      "value": "1.16.0"
    }
  ],
  "thumbnails": [{
    "type": "image",
    "order": 100,
    "url": "https://raw.githubusercontent.com/pnp/sp-dev-fx-aces/main/samples/BasicCard-StatusMessage/assets/demo.png",
    "alt": "Preview"
  }],
  "authors": [{
    "gitHubAccount": "yhabersaat",
    "pictureUrl": "https://github.com/yhabersaat.png",
    "name": "Yves Habersaat",
    "twitter": "yhabersaat"
  }],
  "references": [{
      "name": "Viva Connections Extensibility guidance",
      "description": "Adaptive Card Extensions are client-side components that run in the context of a SharePoint page.",
      "url": "https://aka.ms/viva/connections/extensibility"
    },
    {
      "name": "Adaptive Card Documentation",
      "description": "Detailed documentation on Adaptive Cards including the Adaptive Card designer.",
      "url": "https://adaptivecards.io/"
    }, {
      "name": "Adaptive Card Extension Design Guidance",
      "description": "Design guidance for laying out Adaptive Card Extensions.",
      "url": "https://docs.microsoft.com/en-us/sharepoint/dev/spfx/viva/design/design-intro"
    }
  ]
}]