[{
  "name": "pnp-sp-fx-aces-football-stats",
  "source": "pnp",
  "title": "Football Stats",
  "shortDescription": "This Adaptive Card Extension allows user to choose one of the top five European Football League to get information about current team standing. The data is retrieved using REST API provided by - https://api.football-data.org",
  "url": "https://github.com/pnp/sp-dev-fx-aces/tree/main/samples/PrimaryTextCard-FootballStats",
  "longDescription": [
    "This Adaptive Card Extension allows user to choose one of the top five European Football League to get information about current team standing. The data is retrieved using REST API provided by - https://api.football-data.org"
  ],
  "creationDateTime": "2022-01-25",
  "updateDateTime": "2022-01-25",
  "products": [
    "SharePoint",
    "Viva"
  ],
  "metadata": [{
      "key": "CLIENT-SIDE-DEV",
      "value": "React"
    },
    {
      "key": "SPFX-VERSION",
      "value": "1.13.1"
    }
  ],
  "thumbnails": [{
    "type": "image",
    "order": 100,
    "url": "https://raw.githubusercontent.com/pnp/sp-dev-fx-aces/main/samples/PrimaryTextCard-FootballStats/assets/PrimaryTextCard-FootballStatsDemo.gif",
    "alt": "Preview"
  }],
  "authors": [{
    "gitHubAccount": "msoumit",
    "pictureUrl": "https://github.com/msoumit.png",
    "name": "Soumit Mukherjee",
    "twitter": "msoumit"
  }, {
    "gitHubAccount": "XLR8-0",
    "pictureUrl": "https://github.com/XLR8-0.png",
    "name": "Sourav Paul"
  }, {
    "gitHubAccount": "soumyadeep2207",
    "pictureUrl": "https://github.com/soumyadeep2207.png",
    "name": "Soumyadeep Mukherjee"
  }],
  "references": [{
      "name": "Viva Connections Extensibility guidance",
      "description": "Adaptive Card Extensions are client-side components that run in the context of a SharePoint page.",
      "url": "https://aka.ms/viva/connections/extensibility"
    },
    {
      "name": "Adaptive Card Documentation",
      "description": "Detailed documentation on Adaptive Cards including the Adaptive Card designer.",
      "url": "https://adaptivecards.io/"
    }, {
      "name": "Adaptive Card Extension Design Guidance",
      "description": "Design guidance for laying out Adaptive Card Extensions.",
      "url": "https://docs.microsoft.com/en-us/sharepoint/dev/spfx/viva/design/design-intro"
    }
  ]
}]