[{
  "name": "pnp-sp-fx-aces-my-calendar",
  "source": "pnp",
  "title": "My Calendar Plan",
  "shortDescription": "This ACE show user events for specific day.",
  "url": "https://github.com/pnp/sp-dev-fx-aces/tree/main/samples/PrimaryTextCard-my-calendar-plan",
  "longDescription": [
    "This ACE show user events for specific day."
  ],
  "creationDateTime": "2022-02-25",
  "updateDateTime": "2022-02-25",
  "products": [
    "SharePoint",
    "Viva"
  ],
  "metadata": [{
      "key": "CLIENT-SIDE-DEV",
      "value": "React"
    },
    {
      "key": "SPFX-VERSION",
      "value": "1.13.1"
    }
  ],
  "thumbnails": [{
    "type": "image",
    "order": 100,
    "url": "https://raw.githubusercontent.com/pnp/sp-dev-fx-aces/main/samples/PrimaryTextCard-my-calendar-plan/assets/my-calendar-plan-01.png",
    "alt": "Preview"
  }],
  "authors": [{
    "gitHubAccount": "joaojmendes",
    "pictureUrl": "https://github.com/joaojmendes.png",
    "name": "Jo√£o Mendes"
  }],
  "references": [{
      "name": "Viva Connections Extensibility guidance",
      "description": "Adaptive Card Extensions are client-side components that run in the context of a SharePoint page.",
      "url": "https://aka.ms/viva/connections/extensibility"
    },
    {
      "name": "Adaptive Card Documentation",
      "description": "Detailed documentation on Adaptive Cards including the Adaptive Card designer.",
      "url": "https://adaptivecards.io/"
    }, {
      "name": "Adaptive Card Extension Design Guidance",
      "description": "Design guidance for laying out Adaptive Card Extensions.",
      "url": "https://docs.microsoft.com/en-us/sharepoint/dev/spfx/viva/design/design-intro"
    }
  ]
}]