[{
  "name": "pnp-sp-fx-aces-graph-unreademails",
  "source": "pnp",
  "title": "Unread Emails Viewer",
  "shortDescription": "Checks the users inbox for unread emails",
  "url": "https://github.com/pnp/sp-dev-fx-aces/tree/main/samples/PrimaryTextCard-Graph-UnreadEmails",
  "longDescription": [
    "This Adaptive Card Extension uses the Microsoft Graph to get unread emails in your inbox and displays that as a ACE"
  ],
  "creationDateTime": "2021-12-06",
  "updateDateTime": "2022-05-04",
  "products": [
    "SharePoint",
    "Viva"
  ],
  "metadata": [{
      "key": "CLIENT-SIDE-DEV",
      "value": "React"
    },
    {
      "key": "SPFX-VERSION",
      "value": "1.14.0"
    }
  ],
  "thumbnails": [{
    "type": "image",
    "order": 100,
    "url": "https://raw.githubusercontent.com/pnp/sp-dev-fx-aces/main/samples/PrimaryTextCard-Graph-UnreadEmails/assets/demo.png",
    "alt": "Preview"
  }],
  "authors": [{
    "gitHubAccount": "techienickb",
    "pictureUrl": "https://github.com/techienickb.png",
    "name": "Nick Brown"
  }],
  "references": [{
    "name": "Viva Connections Extensibility guidance",
    "description": "Adaptive Card Extensions are client-side components that run in the context of a SharePoint page.",
    "url": "https://aka.ms/viva/connections/extensibility"
  }]
}]