[{
  "name": "pnp-sp-fx-aces-myemails",
  "source": "pnp",
  "title": "My Notifications",
  "shortDescription": "This Adaptive Card Extension shows current users email using Microsoft Graph.",
  "url": "https://github.com/pnp/sp-dev-fx-aces/tree/main/samples/PrimaryTextCard-MyEmails",
  "longDescription": [
    "This sample shows how to build an ACE with a PrimaryText card view and a quick view to display current logged in user's emails."
  ],
  "creationDateTime": "2022-01-03",
  "updateDateTime": "2022-01-03",
  "products": [
    "SharePoint",
    "Viva"
  ],
  "metadata": [{
      "key": "CLIENT-SIDE-DEV",
      "value": "React"
    },
    {
      "key": "SPFX-VERSION",
      "value": "1.13.1"
    }
  ],
  "thumbnails": [{
    "type": "image",
    "order": 100,
    "url": "https://raw.githubusercontent.com/pnp/sp-dev-fx-aces/main/samples/PrimaryTextCard-MyEmails/assets/ace-inaction.gif",
    "alt": "Preview"
  }],
  "authors": [{
    "gitHubAccount": "siddharth-vaghasia",
    "pictureUrl": "https://github.com/siddharth-vaghasia.png",
    "name": "Siddharth Vaghasia"
  }],
  "references": [{
    "name": "Viva Connections Extensibility guidance",
    "description": "Adaptive Card Extensions are client-side components that run in the context of a SharePoint page.",
    "url": "https://aka.ms/viva/connections/extensibility"
  }]
}]