[{
  "name": "pnp-sp-fx-aces-ace-upcoming-events",
  "source": "pnp",
  "title": "Upcoming Events Viewer",
  "shortDescription": "Loads upcoming events from the users calendar.",
  "url": "https://github.com/pnp/sp-dev-fx-aces/tree/main/samples/BasicCard-Graph-UpcomingEvents",
  "longDescription": [
    "This adaptive card extension sample will load the calendar events from the logged in users Outlook Calendar. It leverages the Microsoft Graph to pull that data into the ACE. Requires Microsoft Graph Directory.Read.All and Calendars.Read permissions."
  ],
  "creationDateTime": "2021-09-29",
  "updateDateTime": "2021-11-29",
  "products": [
    "SharePoint",
    "Office"
  ],
  "metadata": [{
      "key": "CLIENT-SIDE-DEV",
      "value": "React"
    },
    {
      "key": "SPFX-VERSION",
      "value": "1.13.0"
    }
  ],
  "thumbnails": [{
    "type": "image",
    "order": 100,
    "url": "https://raw.githubusercontent.com/pnp/sp-dev-fx-aces/main/samples/BasicCard-Graph-UpcomingEvents/assets/demo.gif",
    "alt": "Preview"
  }],
  "authors": [{
    "gitHubAccount": "zachroberts8668",
    "pictureUrl": "https://github.com/zachroberts8668.png",
    "name": "Zach Roberts"
  }],
  "references": [{
    "name": "Viva Connections Extensibility guidance",
    "description": "Adaptive Card Extensions are client-side components that run in the context of a SharePoint page.",
    "url": "https://aka.ms/viva/connections/extensibility"
  }]
}]
