
[{
  "name": "pnp-sp-fx-aces-recentfiles",
  "source": "pnp",
  "title": "Recent files",
  "shortDescription": "Viva Connection Adaptive Card Extension (ACE) that shows the recent files for the current user.",
  "url": "https://github.com/pnp/sp-dev-fx-aces/tree/main/samples/PrimaryTextCard-RecentFiles",
  "longDescription": [
    "Viva Connection Adaptive Card Extension (ACE) that shows the recent files for the current user."
  ],
  "creationDateTime": "2022-04-11",
  "updateDateTime": "2022-04-11",
  "products": [
    "SharePoint",
    "Viva"
  ],
  "metadata": [{
      "key": "CLIENT-SIDE-DEV",
      "value": "React"
    },
    {
      "key": "SPFX-VERSION",
      "value": "1.14.0"
    }
  ],
  "thumbnails": [{
    "type": "image",
    "order": 100,
    "url": "https://raw.githubusercontent.com/pnp/sp-dev-fx-aces/main/samples/PrimaryTextCard-RecentFiles/assets/QuickViewAndCardView.png",
    "alt": "Preview"
  }],
  "authors": [{
    "gitHubAccount": "GuidoZam",
    "pictureUrl": "https://github.com/GuidoZam.png",
    "name": "Guido Zambarda"
  }],
  "references": [{
      "name": "Viva Connections Extensibility guidance",
      "description": "Adaptive Card Extensions are client-side components that run in the context of a SharePoint page.",
      "url": "https://aka.ms/viva/connections/extensibility"
    },
    {
      "name": "Adaptive Card Documentation",
      "description": "Detailed documentation on Adaptive Cards including the Adaptive Card designer.",
      "url": "https://adaptivecards.io/"
    }, {
      "name": "Adaptive Card Extension Design Guidance",
      "description": "Design guidance for laying out Adaptive Card Extensions.",
      "url": "https://docs.microsoft.com/en-us/sharepoint/dev/spfx/viva/design/design-intro"
    }
  ]
}]