[{
  "name": "pnp-sp-fx-aces-covid-indicator",
  "source": "pnp",
  "title": "COVID-19 Indicator",
  "shortDescription": "This Adaptive Card Extension displays COVID-19 data from the specified country.",
  "url": "https://github.com/pnp/sp-dev-fx-aces/tree/main/samples/PrimaryTextCard-Covid-Indicator",
  "longDescription": [
    "This Adaptive Card Extension allows the user to select a country and display real-time COVID-19 related data in the card. In the QuickView it displays additional data such as total population, severity of cases, and deaths."
  ],
  "creationDateTime": "2021-12-12",
  "updateDateTime": "2021-12-12",
  "products": [
    "SharePoint",
    "Viva"
  ],
  "metadata": [{
      "key": "CLIENT-SIDE-DEV",
      "value": "React"
    },
    {
      "key": "SPFX-VERSION",
      "value": "1.13.1"
    }
  ],
  "thumbnails": [{
    "type": "image",
    "order": 100,
    "url": "https://raw.githubusercontent.com/pnp/sp-dev-fx-aces/main/samples/PrimaryTextCard-Covid-Indicator/assets/demo.gif",
    "alt": "Preview"
  }],
  "authors": [{
    "gitHubAccount": "joaojmendes",
    "pictureUrl": "https://github.com/joaojmendes.png",
    "name": "Jo√£o Mendes"
  }],
  "references": [{
    "name": "Viva Connections Extensibility guidance",
    "description": "Adaptive Card Extensions are client-side components that run in the context of a SharePoint page.",
    "url": "https://aka.ms/viva/connections/extensibility"
  }]
}]