[{
  "name": "pnp-sp-fx-aces-joinnewteam",
  "source": "pnp",
  "title": "Join New Team",
  "shortDescription": "This Adaptive Card Extension shows public Teams the user is not a member of and allows them to join the Team.",
  "url": "https://github.com/pnp/sp-dev-fx-aces/tree/main/samples/PrimaryTextCard-Graph-JoinNewTeams",
  "longDescription": [
    "This Adaptive Card Extension shows how to us the Microsoft Graph to pull the list of teams for a tenant and how to programmatically add a user to the team."
  ],
  "creationDateTime": "2022-02-28",
  "updateDateTime": "2022-02-28",
  "products": [
    "SharePoint",
    "Viva"
  ],
  "metadata": [{
      "key": "CLIENT-SIDE-DEV",
      "value": "React"
    },
    {
      "key": "SPFX-VERSION",
      "value": "1.13.1"
    }
  ],
  "thumbnails": [{
    "type": "image",
    "order": 100,
    "url": "https://raw.githubusercontent.com/pnp/sp-dev-fx-aces/main/samples/PrimaryTextCard-Graph-JoinNewTeams/assets/Demo1.gif",
    "alt": "Preview"
  }],
  "authors": [{
    "gitHubAccount": "a1mery",
    "pictureUrl": "https://github.com/a1mery.png",
    "name": "Aimery Thomas"
  }],
  "references": [{
      "name": "Viva Connections Extensibility guidance",
      "description": "Adaptive Card Extensions are client-side components that run in the context of a SharePoint page.",
      "url": "https://aka.ms/viva/connections/extensibility"
    },
    {
      "name": "Adaptive Card Documentation",
      "description": "Detailed documentation on Adaptive Cards including the Adaptive Card designer.",
      "url": "https://adaptivecards.io/"
    }, {
      "name": "Adaptive Card Extension Design Guidance",
      "description": "Design guidance for laying out Adaptive Card Extensions.",
      "url": "https://docs.microsoft.com/en-us/sharepoint/dev/spfx/viva/design/design-intro"
    }
  ]
}]
