[
  {
    "name": "pnp-sp-fx-aces-ace-articlecontent",
    "source": "pnp",
    "title": "Article Content at a glance",
    "shortDescription": "Adaptive Card displays of Article Content",
    "url": "https://github.com/pnp/sp-dev-fx-aces/tree/master/samples/ImageCard-At-a-glance",
    "longDescription": [
      "ACE with multiple card views to show the first few sentences of an article in a SharePoint site"
    ],
    "creationDateTime": "2021-10-06",
    "updateDateTime": "2021-10-06",
    "products": [
      "SharePoint",
      "Office",
      "Viva"
    ],
    "metadata": [
      {
        "key": "CLIENT-SIDE-DEV",
        "value": "React"
      },
      {
        "key": "SPFX-VERSION",
        "value": "1.13.0"
      }
    ],
    "thumbnails": [
      {
        "type": "image",
        "order": 100,
        "url": "https://github.com/pnp/sp-dev-fx-aces/raw/main/samples/ImageCard-At-a-glance/assets/demo.gif",
        "alt": "London Transport"
      }
    ],
    "authors": [
      {
        "gitHubAccount": "anoopt",
        "company": "Content+Cloud",
        "pictureUrl": "https://github.com/anoopt.png",
        "name": "Anoop Tatti",
        "twitter": "anooptells"
      }
    ],
    "references": [
      {
        "name": "Viva Connections Extensibility guidance",
        "description": "Adaptive Card Extensions are client-side components that run in the context of a SharePoint page.",
        "url": "https://aka.ms/viva/connections/extensibility"
      }
    ]
  }
]
